{"$id":"direct-operation-spec-v3.schema.json","$schema":"https://json-schema.org/draft/2020-12/schema","additionalProperties":false,"properties":{"canonical_profile":{"const":"schuss-canonical-json-v1"},"compatibility_mode":{"const":"exact-source-identity-normalized-lowering-task028-v1"},"content_hash":{"pattern":"^sha256:[0-9a-f]{64}$","type":"string"},"contract_reference":{"additionalProperties":false,"properties":{"component_contract_id":{"pattern":"^schuss-component-contract-[0-9]{6}$","type":"string"},"content_hash":{"pattern":"^sha256:[0-9a-f]{64}$","type":"string"},"revision":{"minimum":1,"type":"integer"}},"required":["component_contract_id","revision","content_hash"],"type":"object"},"direct_operation_spec_id":{"pattern":"^schuss-direct-operation-spec-0000(?:1[5-9]|2[0-9])$","type":"string"},"evidence_boundary":{"const":"backend-lowering-ir-only-levels-1-through-3"},"exclusions":{"items":{"minLength":1,"type":"string"},"type":"array","uniqueItems":true,"x-schuss-array-kind":"set"},"family_reference":{"additionalProperties":false,"properties":{"content_hash":{"pattern":"^sha256:[0-9a-f]{64}$","type":"string"},"family_id":{"pattern":"^schuss-family-[0-9]{6}$","type":"string"},"revision":{"minimum":1,"type":"integer"}},"required":["family_id","revision","content_hash"],"type":"object"},"native_binding_reference":{"additionalProperties":false,"properties":{"content_hash":{"pattern":"^sha256:[0-9a-f]{64}$","type":"string"},"implementation_id":{"pattern":"^schuss-implementation-[0-9]{6}$","type":"string"},"revision":{"minimum":1,"type":"integer"}},"required":["implementation_id","revision","content_hash"],"type":"object"},"numeric_semantics":{"items":{"minLength":1,"type":"string"},"minItems":1,"type":"array","x-schuss-array-kind":"sequence"},"opcode":{"pattern":"^[a-z0-9]+(?:-[a-z0-9]+)*$","type":"string"},"rate_domain":{"enum":["audio","control"]},"requirements":{"items":{"minLength":1,"type":"string"},"type":"array","uniqueItems":true,"x-schuss-array-kind":"set"},"revision":{"const":1},"runtime_dependencies":{"items":{"minLength":1,"type":"string"},"type":"array","uniqueItems":true,"x-schuss-array-kind":"set"},"schedule_semantics":{"items":{"minLength":1,"type":"string"},"minItems":1,"type":"array","x-schuss-array-kind":"sequence"},"schema_version":{"const":"direct-operation-spec-v3"},"source_identity":{"additionalProperties":false,"properties":{"byte_sha256":{"pattern":"^[0-9a-f]{64}$","type":"string"},"canonical_observation_sha256":{"pattern":"^[0-9a-f]{64}$","type":"string"},"catalog_implementation_id":{"pattern":"^schuss-implementation-[0-9]{6}$","type":"string"},"definition_index":{"minimum":0,"type":"integer"},"legacy_id":{"minLength":1,"type":"string"},"legacy_uuid_sha256":{"pattern":"^sha256:[0-9a-f]{64}$","type":"string"},"observation_reference":{"pattern":"^legacy-resolved-catalog-v0:object:[0-9]+$","type":"string"},"portable_path":{"pattern":"^[A-Za-z0-9][A-Za-z0-9._ +%-]*(?:/[A-Za-z0-9][A-Za-z0-9._ +%-]*)*$","type":"string"},"provenance_tags":{"items":{"minLength":1,"type":"string"},"type":"array","uniqueItems":true,"x-schuss-array-kind":"set"},"source_commit":{"pattern":"^[0-9a-f]{40}$","type":"string"},"source_id":{"enum":["axoloti-factory","axoloti-contrib"]},"variant_index":{"minimum":0,"type":"integer"}},"required":["catalog_implementation_id","observation_reference","variant_index","legacy_id","legacy_uuid_sha256","source_id","source_commit","portable_path","definition_index","byte_sha256","canonical_observation_sha256","provenance_tags"],"type":"object"},"state_semantics":{"items":{"minLength":1,"type":"string"},"minItems":1,"type":"array","x-schuss-array-kind":"sequence"}},"required":["schema_version","canonical_profile","direct_operation_spec_id","revision","content_hash","opcode","compatibility_mode","rate_domain","family_reference","contract_reference","native_binding_reference","source_identity","runtime_dependencies","numeric_semantics","state_semantics","schedule_semantics","requirements","exclusions","evidence_boundary"],"title":"Schuss exact Task 028 normalized direct operation specification v3","type":"object"}
