{"canonical_profile":"schuss-canonical-json-v1","compatibility_mode":"exact-source-identity-normalized-lowering-task028-v1","content_hash":"sha256:46d89566d0ef095b7a68c55c2d3e2fe504217947aa8cf0298b3b9e771a237ea4","contract_reference":{"component_contract_id":"schuss-component-contract-000010","content_hash":"sha256:813b4aa7cc9d3c6fab6b34a99db30cc8badfc1912091bb36a9ab161b82f7f848","revision":1},"direct_operation_spec_id":"schuss-direct-operation-spec-000016","evidence_boundary":"backend-lowering-ir-only-levels-1-through-3","exclusions":["device timing","scheduler behavior outside the operation contract"],"family_reference":{"content_hash":"sha256:e02062cfd669e2e584a14305d584da6d46a032836a5d23dd6e1f10d5ddfb5295","family_id":"schuss-family-000029","revision":1},"native_binding_reference":{"content_hash":"sha256:12a040d5c04933a5f5a7f4f60690f199b90b6392d62b5076a1fbb4238963fcfd","implementation_id":"schuss-implementation-000098","revision":1},"numeric_semantics":["Q27 and Boolean facet representations remain those of the exact component contract.","exact Boolean control facets","retained rising-edge state identity"],"opcode":"rising-edge-toggle-bool32","rate_domain":"control","requirements":["exact Boolean control facets","retained rising-edge state identity"],"revision":1,"runtime_dependencies":[],"schedule_semantics":["One normalized control-domain operation is emitted; scheduler and runtime execution are outside Task 028."],"schema_version":"direct-operation-spec-v3","source_identity":{"byte_sha256":"128c4353605ae1ebd8c109fe1e5f15d987fc65a0ebc4ac63789e8e484d9cd5ae","canonical_observation_sha256":"26ad1762b9e7bc39ffb5211797768984d731af0a2ed51d4eee70e6a7e3891bcf","catalog_implementation_id":"schuss-implementation-000049","definition_index":0,"legacy_id":"logic/toggle","legacy_uuid_sha256":"sha256:2978dc9bf6518d80a91e5b6b406bff71894655c0975af9c87879dce41aebc49b","observation_reference":"legacy-resolved-catalog-v0:object:229","portable_path":"objects/logic/toggle.axo","provenance_tags":[],"source_commit":"25d2615ed5233546d617017666a4ab1e60a8c506","source_id":"axoloti-factory","variant_index":229},"state_semantics":["Component-instance state is explicit: trigger-history, latched-output."]}
