{"canonical_profile":"schuss-canonical-json-v1","compatibility_mode":"exact-source-identity-normalized-lowering-task028-v1","content_hash":"sha256:b588a6084d09537acc4f2c791b94a6a8846dacd6662cfce1391834f1272d23f4","contract_reference":{"component_contract_id":"schuss-component-contract-000018","content_hash":"sha256:5487dab7231dab7e3453b8eba4af2e95caaa55a491692c42624277f1aa89d3c4","revision":1},"direct_operation_spec_id":"schuss-direct-operation-spec-000018","evidence_boundary":"backend-lowering-ir-only-levels-1-through-3","exclusions":["ARM/device/audible behavior","provenance-only support inference"],"family_reference":{"content_hash":"sha256:f2d6b946ed234e9aa0dbcd5d63410897df2ef0b0f72cb17956e446f3f95a7f29","family_id":"schuss-family-000037","revision":1},"native_binding_reference":{"content_hash":"sha256:cbf45052ddf8c7ac3fb77150225b4dde5e0472b67c6be2450598b0184f30ff5a","implementation_id":"schuss-implementation-000100","revision":1},"numeric_semantics":["Q27 and Boolean facet representations remain those of the exact component contract.","exact Q27 audio/control facets","exact Braids header locator"],"opcode":"struck-drum-voice-q27","rate_domain":"audio","requirements":["exact Braids header locator","exact Q27 audio/control facets"],"revision":1,"runtime_dependencies":["brds-digital-header"],"schedule_semantics":["One normalized audio-domain operation is emitted; scheduler and runtime execution are outside Task 028."],"schema_version":"direct-operation-spec-v3","source_identity":{"byte_sha256":"fad89e45517b7e34affd8951c029a21cbf3eadde12c69b1d27e23942c1c9164c","canonical_observation_sha256":"6674425d44dea3d1da6fe87223878ad9ff31e0d23ab8dfd27074633f2e7790c0","catalog_implementation_id":"schuss-implementation-000057","definition_index":0,"legacy_id":"osc/brds/struckdrum","legacy_uuid_sha256":"sha256:72176317fdacd25cfe659491e4c907bced05ba9ae6bb4357123a028e40e7fb29","observation_reference":"legacy-resolved-catalog-v0:object:527","portable_path":"objects/osc/brds/struckdrum.axo","provenance_tags":["mutable-instruments-derived"],"source_commit":"25d2615ed5233546d617017666a4ab1e60a8c506","source_id":"axoloti-factory","variant_index":527},"state_semantics":["Component-instance state is explicit: voice-state, strike-history."]}
