{"canonical_profile":"schuss-canonical-json-v1","compatibility_mode":"exact-source-identity-normalized-lowering-task028-v1","content_hash":"sha256:ef9f733533c584842a44cf508c262302c90c862221e2d3a861e1e3bb21f362a2","contract_reference":{"component_contract_id":"schuss-component-contract-000027","content_hash":"sha256:9917941da88aea188a102a4313766c80e2132b24214c069fa064b37a4f363ab2","revision":1},"direct_operation_spec_id":"schuss-direct-operation-spec-000025","evidence_boundary":"backend-lowering-ir-only-levels-1-through-3","exclusions":["frequency-response measurement","stability/resource measurement"],"family_reference":{"content_hash":"sha256:f90816a68e938e35bd4096b6a4a27f9c9861b11c4c21d149c97476a306f2c82e","family_id":"schuss-family-000050","revision":1},"native_binding_reference":{"content_hash":"sha256:ff5326912c4e05d303289607ff1c8d6f39fe0b4c11480211d3c2b3053f6e979c","implementation_id":"schuss-implementation-000107","revision":1},"numeric_semantics":["Q27 and Boolean facet representations remain those of the exact component contract.","exact audio/pitch/resonance facets","retained biquad and pitch-runtime identities"],"opcode":"two-pole-resonant-lowpass-audio-q27","rate_domain":"audio","requirements":["exact audio/pitch/resonance facets","retained biquad and pitch-runtime identities"],"revision":1,"runtime_dependencies":["ksoloti-biquad-runtime","ksoloti-pitch-runtime"],"schedule_semantics":["One normalized audio-domain operation is emitted; scheduler and runtime execution are outside Task 028."],"schema_version":"direct-operation-spec-v3","source_identity":{"byte_sha256":"dcb838f4df59d97bba8a134ef8c69d314035be8fb4d77687479a6e7b38264674","canonical_observation_sha256":"46500b73e1108afd900faddb409e7077b3a1ab5773c013b02c462714f7300d72","catalog_implementation_id":"schuss-implementation-000070","definition_index":0,"legacy_id":"filter/vcf3","legacy_uuid_sha256":"sha256:d89f1722fa9f8852a96870a439ba3700fbe968179cf18d41f8d88db51215e4ae","observation_reference":"legacy-resolved-catalog-v0:object:162","portable_path":"objects/filter/vcf3.axo","provenance_tags":[],"source_commit":"25d2615ed5233546d617017666a4ab1e60a8c506","source_id":"axoloti-factory","variant_index":162},"state_semantics":["Component-instance state is explicit: biquad-state."]}
