{"canonical_profile":"schuss-canonical-json-v1","compatibility_mode":"exact-source-identity-normalized-lowering-task028-v1","content_hash":"sha256:4eab3f83f747a13486b1960b0a966e8e701d4184513aac6d8e41add72e939882","contract_reference":{"component_contract_id":"schuss-component-contract-000030","content_hash":"sha256:98cc597610458700346655fb8ead28b7decaa6a0b4880ba7732cafa3189f0650","revision":1},"direct_operation_spec_id":"schuss-direct-operation-spec-000028","evidence_boundary":"backend-lowering-ir-only-levels-1-through-3","exclusions":["control-rate addition","integer addition"],"family_reference":{"content_hash":"sha256:2097fea546b840536ee651e89da92e6751fb1a824117a69015025787f6786177","family_id":"schuss-family-000023","revision":1},"native_binding_reference":{"content_hash":"sha256:a354bd833d5b04416d342e70f1cd52ee875c0bf0046f0e40dbfea0bc3a0ea801","implementation_id":"schuss-implementation-000110","revision":1},"numeric_semantics":["Q27 and Boolean facet representations remain those of the exact component contract.","definition index 1 audio overload","exact two-input Q27 addition facets"],"opcode":"addition-audio-q27","rate_domain":"audio","requirements":["definition index 1 audio overload","exact two-input Q27 addition facets"],"revision":1,"runtime_dependencies":[],"schedule_semantics":["One normalized audio-domain operation is emitted; scheduler and runtime execution are outside Task 028."],"schema_version":"direct-operation-spec-v3","source_identity":{"byte_sha256":"5add4da6aa33456cf23a1a6993d9316bd993765db7569a1a72387c4569f24a20","canonical_observation_sha256":"e2fb0ec110ac75ddcf30317474155bdbd574176753f9e29e1441d9c4d8d60578","catalog_implementation_id":"schuss-implementation-000034","definition_index":1,"legacy_id":"math/+","legacy_uuid_sha256":"sha256:4d5bd28f364b3acca40f833efdd04489836712abfea93e6521cbba70229e32a4","observation_reference":"legacy-resolved-catalog-v0:object:255","portable_path":"objects/math/PLUS.axo","provenance_tags":[],"source_commit":"25d2615ed5233546d617017666a4ab1e60a8c506","source_id":"axoloti-factory","variant_index":255},"state_semantics":["The normalized operation declares no component-instance state."]}
