{"canonical_profile":"schuss-canonical-json-v1","compatibility_mode":"exact-source-identity-normalized-lowering-task028-v1","content_hash":"sha256:0061f107c5be279a43a6341c6999d479b149f0434e7cd6efa53c05b2cca6d1e4","contract_reference":{"component_contract_id":"schuss-component-contract-000029","content_hash":"sha256:2dd30b99dac2a5fbca5317107d825fab71d02760f4a737a5d547f0b3d5e7ebea","revision":1},"direct_operation_spec_id":"schuss-direct-operation-spec-000027","evidence_boundary":"backend-lowering-ir-only-levels-1-through-3","exclusions":["control-rate variants","other mixer arities"],"family_reference":{"content_hash":"sha256:55ea1c9fb2002723347605c6078ef51b45dde293dbbb1215b40c98e0cf62d6f3","family_id":"schuss-family-000057","revision":1},"native_binding_reference":{"content_hash":"sha256:a846d7f7ce84263b4209c9bc95ed4f36ff886eb49cfac4f41feacab0a3678999","implementation_id":"schuss-implementation-000109","revision":1},"numeric_semantics":["Q27 and Boolean facet representations remain those of the exact component contract.","definition index 1 audio overload","exact bus/two-input/gain facets"],"opcode":"two-input-mixer-audio-q27","rate_domain":"audio","requirements":["definition index 1 audio overload","exact bus/two-input/gain facets"],"revision":1,"runtime_dependencies":["arm-fixed-point-runtime"],"schedule_semantics":["One normalized audio-domain operation is emitted; scheduler and runtime execution are outside Task 028."],"schema_version":"direct-operation-spec-v3","source_identity":{"byte_sha256":"4693c4564d51a300223586400c12cd1cf101cb4aacc1774fb310c2cc2957100e","canonical_observation_sha256":"4688c7e7ff3cb1fc637c109860796be5362412a9bd04154db72921f6544b13e8","catalog_implementation_id":"schuss-implementation-000077","definition_index":1,"legacy_id":"mix/mix 2","legacy_uuid_sha256":"sha256:75ccd9a03fac8e56235f6da1a053702de451db7570ec2ac09e5152b17abd2688","observation_reference":"legacy-resolved-catalog-v0:object:421","portable_path":"objects/mix/mix 2.axo","provenance_tags":[],"source_commit":"25d2615ed5233546d617017666a4ab1e60a8c506","source_id":"axoloti-factory","variant_index":421},"state_semantics":["The normalized operation declares no component-instance state."]}
