{"canonical_profile":"schuss-canonical-json-v1","compatibility_mode":"exact-source-identity-normalized-lowering-task028-v1","content_hash":"sha256:21cd72b667b7421c0ffa5767fe8169ed1203b0d3f7bb14438c5044a0ff192b40","contract_reference":{"component_contract_id":"schuss-component-contract-000011","content_hash":"sha256:21fde01ba278cd35ef8209805334c9747cb6fe0064a63b5913e38a3e32fcc144","revision":1},"direct_operation_spec_id":"schuss-direct-operation-spec-000017","evidence_boundary":"backend-lowering-ir-only-levels-1-through-3","exclusions":["realtime scheduling","statistical validation"],"family_reference":{"content_hash":"sha256:c28a53226d11aa6ffa85cd5e8e461b425a60ef1d47d7b799febb8d49e8fa722d","family_id":"schuss-family-000030","revision":1},"native_binding_reference":{"content_hash":"sha256:e618e53dbe4bf9790a705ab75779425396b881b0363e0beacebd3b5239e18d0b","implementation_id":"schuss-implementation-000099","revision":1},"numeric_semantics":["Q27 and Boolean facet representations remain those of the exact component contract.","exact control facets and attributes","retained random-runtime identity"],"opcode":"pseudo-euclidean-gate-control","rate_domain":"control","requirements":["exact control facets and attributes","retained random-runtime identity"],"revision":1,"runtime_dependencies":["ksoloti-runtime-random"],"schedule_semantics":["One normalized control-domain operation is emitted; scheduler and runtime execution are outside Task 028."],"schema_version":"direct-operation-spec-v3","source_identity":{"byte_sha256":"e145905fc777986817072d36c9941e8a1863af6286361115b6944016727b2f35","canonical_observation_sha256":"360f3a9550f2e0023440acca40c358973f22aadf50143708ac00b8bdf99eaaf3","catalog_implementation_id":"schuss-implementation-000050","definition_index":0,"legacy_id":"jls/seq/peuclid_seq","legacy_uuid_sha256":"sha256:d98066facf5322719499a3002f75b8b1970863919279f05bf15e30ac7401eecf","observation_reference":"legacy-resolved-catalog-v0:object:1208","portable_path":"objects/jls/seq/peuclid_seq.axo","provenance_tags":[],"source_commit":"2e994478c0ab15fb1daa3bb4b86c88e22952d99c","source_id":"axoloti-contrib","variant_index":1208},"state_semantics":["Component-instance state is explicit: recurrence, trigger-history, reset-history."]}
